X,Y,gid,vill_,vill_id,name,amp_id,tam_name,amp_name,prv_name,icon_url
99.3339583506248,18.9208675960469,"1320","18004","1285",บ้านปางไฮ,"41304",ป่าเมี่ยง,ดอยสะเก็ด,เชียงใหม่,./0.png
98.9445938026596,18.9202558776878,"1321","18005","1288",บ้านต้นแก้ว (ต้นตื่น),"41309",ริมใต้,แม่ริม,เชียงใหม่,./0.png
98.9569395127486,18.9202591510882,"1322","18006","1289","บ้านหัวดง (กลาง,สุทโธ)","41309",ริมใต้,แม่ริม,เชียงใหม่,./0.png
98.9654865441486,18.9202609364466,"1323","18007","1290","บ้านทรายมูล (ดวงดี,ต้อมล้อม)","41309",ริมใต้,แม่ริม,เชียงใหม่,./0.png
98.9635875951062,18.9184530171868,"1324","18008","1304",บ้านทรายมูล,"41309",ริมใต้,แม่ริม,เชียงใหม่,./0.png
98.9445946958586,18.9175445435096,"1325","18009","1306",บ้านท้องฝาย (หนองผำ),"41309",ริมใต้,แม่ริม,เชียงใหม่,./0.png
98.7204788184862,18.9164386756243,"1326","18010","1311",บ้านกองขากหลวง,"41311",สะเมิงใต้,สะเมิง,เชียงใหม่,./0.png
98.9275016952264,18.9157311009606,"1327","18011","1313",บ้านทุ่งโป่ง (น้ำตกแม่สา),"41309",แม่แรม,แม่ริม,เชียงใหม่,./0.png
98.9911278809901,18.9157450392187,"1328","18012","1314",บ้านเกษตรใหม่,"41313",หนองหาร,สันทราย,เชียงใหม่,./0.png
99.0186673816248,18.9139367553305,"1329","18013","1324",บ้านวิเวก,"41313",หนองหาร,สันทราย,เชียงใหม่,./0.png
99.1212271756802,18.9129943549789,"1330","18014","1327",บ้านพระบาทตีนนก,"41313",หนองแหย่ง,สันทราย,เชียงใหม่,./0.png
99.1212271756802,18.9129943549789,"1331","18015","1328",บ้านดอย,"41313",หนองแหย่ง,สันทราย,เชียงใหม่,./0.png
98.6046365170054,18.9108056209446,"1332","18016","1332",บ้านอมลอง,"41311",แม่สาบ,สะเมิง,เชียงใหม่,./0.png
98.8059527527358,18.9111250042592,"1333","18017","1333",บ้านปงไคร้,"41309",โป่งแยง,แม่ริม,เชียงใหม่,./0.png
98.9265540239922,18.9112118364953,"1334","18018","1334",บ้านห้วยโจ้,"41309",แม่แรม,แม่ริม,เชียงใหม่,./0.png
99.0386090848175,18.911222343807,"1335","18019","1336",บ้านตลาดใหม่,"41313",ป่าไผ่,สันทราย,เชียงใหม่,./0.png
99.0395582790059,18.9094145857995,"1336","18020","1342",บ้านหนองหลวงพัฒนา,"41313",ป่าไผ่,สันทราย,เชียงใหม่,./0.png
98.8088046736782,18.9084166353911,"1337","18021","1344",บ้านแม่สาใหม่,"41309",โป่งแยง,แม่ริม,เชียงใหม่,./0.png
99.0006243029572,18.9085150169357,"1338","18022","1347",บ้านห้วยเกี๋ยง,"41313",หนองหาร,สันทราย,เชียงใหม่,./0.png
98.4204303003271,18.9067072649764,"1339","18023","1350",บ้านแม่ตะละเหนือ,"41307",บ้านจันทร์,แม่แจ่ม,เชียงใหม่,./0.png
98.9151604262042,18.9075918677883,"1340","18024","1351",บ้านป่าม่วง (แม่ใน),"41309",แม่แรม,แม่ริม,เชียงใหม่,./0.png
99.0414570515357,18.9076066131629,"1341","18025","1352",บ้านศรีบุญเรือง,"41313",ป่าไผ่,สันทราย,เชียงใหม่,./0.png
99.1288193489806,18.9066628019199,"1342","18026","1353",บ้านข้างน้ำ,"41304",ลวงเหนือ,ดอยสะเก็ด,เชียงใหม่,./0.png
98.95029609463,18.9057970310412,"1343","18027","1355",บ้านศรีบุญเรือง,"41309",แม่สา,แม่ริม,เชียงใหม่,./0.png
98.9702374535168,18.9058012953711,"1344","18028","1356",บ้านท่าวัง,"41309",แม่สา,แม่ริม,เชียงใหม่,./0.png
98.9768845741673,18.9058022412199,"1345","18029","1357",บ้านขอนตาล (สบริม),"41309",เหมืองแก้ว,แม่ริม,เชียงใหม่,./0.png
99.2399198859968,18.9056487825864,"1346","18030","1358",บ้านโป่งสามัคคี,"41304",ป่าเมี่ยง,ดอยสะเก็ด,เชียงใหม่,./0.png
98.9787838654851,18.9048986880417,"1347","18031","1359",บ้านต้นผึ้ง (สันใต้),"41309",เหมืองแก้ว,แม่ริม,เชียงใหม่,./0.png
98.9673890378588,18.9039932578064,"1348","18032","1361",บ้านสบสา (บ่อปุ๊),"41309",แม่สา,แม่ริม,เชียงใหม่,./0.png
98.9464986030285,18.9030846376423,"1349","18033","1364",บ้านท่าไคร้,"41309",แม่สา,แม่ริม,เชียงใหม่,./0.png
98.8828778904817,18.902151651495,"1350","18034","1366",บ้านแม่แมะ (ห้วยนาหวาย),"41309",แม่แรม,แม่ริม,เชียงใหม่,./0.png
99.004422553021,18.9021885067241,"1351","18035","1367",บ้านแม่โจ้ใหม่,"41313",หนองหาร,สันทราย,เชียงใหม่,./0.png
99.2437129694337,18.9020287523097,"1352","18036","1368",บ้านโป่งกุ่ม,"41304",แม่โป่ง,ดอยสะเก็ด,เชียงใหม่,./0.png
99.2892917029525,18.9019633893153,"1353","18037","1369",บ้านปางจุมปี,"41312",ห้วยแก้ว,สันกำแพง,เชียงใหม่,./0.png
98.6483387484374,18.900952065279,"1354","18038","1370",บ้านน้ำบุ่น,"41311",แม่สาบ,สะเมิง,เชียงใหม่,./0.png
98.9540956805861,18.9012791098421,"1355","18039","1371",บ้านดอนชัย,"41309",แม่สา,แม่ริม,เชียงใหม่,./0.png
99.1031770490538,18.9012561383024,"1356","18040","1372",บ้านหนองบัว,"41313",หนองแหย่ง,สันทราย,เชียงใหม่,./0.png
99.3158775099382,18.9010163322871,"1357","18041","1373",บ้านป๊อก,"41312",ห้วยแก้ว,สันกำแพง,เชียงใหม่,./0.png
99.0680428863912,18.9003685432665,"1358","18042","1377",บ้านเกษตรพัฒนา,"41313",ป่าไผ่,สันทราย,เชียงใหม่,./0.png
99.005372034886,18.899477140974,"1359","18043","1382",บ้านแม่โจ้,"41313",หนองหาร,สันทราย,เชียงใหม่,./0.png
98.3274118894588,18.8973565074012,"1360","18044","1385",บ้านสบแม่รวม,"41307",แม่ศึก,แม่แจ่ม,เชียงใหม่,./0.png
99.0803862683196,18.8985560549485,"1361","18045","1386",บ้านป่าเสร้าหลวง,"41313",เมืองเล็น,สันทราย,เชียงใหม่,./0.png
99.0946294697431,18.8985493491165,"1362","18046","1387",บ้านแม่ฮักพัฒนา,"41313",หนองแหย่ง,สันทราย,เชียงใหม่,./0.png
99.1259638125489,18.8976269759901,"1363","18047","1390",บ้านทุ่งกอลาน,"41304",ลวงเหนือ,ดอยสะเก็ด,เชียงใหม่,./0.png
98.9028219175225,18.8967404748277,"1364","18048","1391",บ้านภูพิงค์,"41309",แม่แรม,แม่ริม,เชียงใหม่,./0.png
98.9825831349248,18.895861280431,"1365","18049","1397","บ้านสันเหนือ (แม่ปะ,ป่าปง)","41309",เหมืองแก้ว,แม่ริม,เชียงใหม่,./0.png
98.9873307982705,18.8958616646397,"1366","18050","1398",บ้านป่าไผ่,"41309",เหมืองแก้ว,แม่ริม,เชียงใหม่,./0.png
99.0604448040376,18.8958522691549,"1367","18051","1399",บ้านหนองเต่าคำใหม่,"41313",ป่าไผ่,สันทราย,เชียงใหม่,./0.png
99.0965270085889,18.895837034604,"1368","18052","1400",บ้านทุ่งข้าวตอกใหม่,"41313",หนองแหย่ง,สันทราย,เชียงใหม่,./0.png
98.9104191702322,18.894936731683,"1369","18053","1403",บ้านโรงวัว,"41309",แม่แรม,แม่ริม,เชียงใหม่,./0.png
98.986381411758,18.8940540359117,"1370","18054","1406",บ้านดอนตัน,"41309",เหมืองแก้ว,แม่ริม,เชียงใหม่,./0.png
99.1202639880954,18.8940156346678,"1371","18055","1407",บ้านเมืองวะ,"41304",ลวงเหนือ,ดอยสะเก็ด,เชียงใหม่,./0.png
98.9493503126457,18.8931438542575,"1372","18056","1409",บ้านแม่สาน้อย,"41309",แม่สา,แม่ริม,เชียงใหม่,./0.png
98.9569464491785,18.8931457685677,"1373","18057","1410",บ้านแม่สาหลวง,"41309",แม่สา,แม่ริม,เชียงใหม่,./0.png
99.1345060649278,18.8931020967756,"1374","18058","1412",บ้านสันทราย,"41304",ลวงเหนือ,ดอยสะเก็ด,เชียงใหม่,./0.png
99.0386047323826,18.8922429648088,"1375","18059","1416",บ้านหนองโบสถ,"41313",ป่าไผ่,สันทราย,เชียงใหม่,./0.png
99.0832317823752,18.8922283423745,"1376","18060","1418",บ้านหนองก้นครุ,"41313",เมืองเล็น,สันทราย,เชียงใหม่,./0.png
99.0946254073048,18.8913191124604,"1377","18061","1426",บ้านทุ่งข้าวตอก,"41313",หนองแหย่ง,สันทราย,เชียงใหม่,./0.png
99.0025232402101,18.8904393932962,"1378","18062","1429",บ้านทุ่งหมื่นน้อย,"41313",หนองหาร,สันทราย,เชียงใหม่,./0.png
99.0661398670089,18.8904276469784,"1379","18063","1430",บ้านศรีวังธาร,"41313",ป่าไผ่,สันทราย,เชียงใหม่,./0.png
99.120260761825,18.8894967390213,"1380","18064","1438",บ้านดงเจริญชัย,"41313",หนองแหย่ง,สันทราย,เชียงใหม่,./0.png
98.6796978026549,18.8883559838286,"1381","18065","1439",บ้านกองขากน้อย,"41311",สะเมิงใต้,สะเมิง,เชียงใหม่,./0.png
98.9360587914649,18.8886208541369,"1382","18066","1440","บ้านโป่งแยงนอก (ดอนน้อย,ใหม่)","41309",แม่สา,แม่ริม,เชียงใหม่,./0.png
99.0547452610516,18.8886237890233,"1383","18067","1441",บ้านหนองเต่าคำ,"41313",ป่าไผ่,สันทราย,เชียงใหม่,./0.png
98.9873314779884,18.8868238531481,"1384","18068","1447",บ้านทุ่งข้าวเน่า,"41309",เหมืองแก้ว,แม่ริม,เชียงใหม่,./0.png
99.0300581556376,18.886821855499,"1385","18069","1448",บ้านพัฒนาทรายแก้ว,"41313",หนองหาร,สันทราย,เชียงใหม่,./0.png
99.0129674157747,18.8859200509363,"1386","18070","1450",บ้านสหกรณ์นิคม,"41313",หนองหาร,สันทราย,เชียงใหม่,./0.png
99.0281590413475,18.8859183711917,"1387","18071","1451",บ้านหนองป่าข้าว,"41313",หนองหาร,สันทราย,เชียงใหม่,./0.png
99.0594917608199,18.8859109874939,"1388","18072","1452",บ้านหม้อ,"41313",ป่าไผ่,สันทราย,เชียงใหม่,./0.png
99.0794303284673,18.8849997593618,"1389","18073","1456",บ้านเมืองวะ,"41313",เมืองเล็น,สันทราย,เชียงใหม่,./0.png
99.1658320131047,18.8849427880123,"1390","18074","1457",บ้านแม่ดอกแดง,"41304",เชิงดอย,ดอยสะเก็ด,เชียงใหม่,./0.png
98.555329386628,18.883581366233,"1391","18075","1459",บ้านเด่นฮ่อม,"41311",บ่อแก้ว,สะเมิง,เชียงใหม่,./0.png
98.7964904846576,18.8830978206355,"1392","18076","1462",บ้านปางลุง (บวกเต๋ย),"41309",โป่งแยง,แม่ริม,เชียงใหม่,./0.png
98.820226871906,18.8831222776183,"1393","18077","1464","บ้านโป่งแยงใน (เหล่า,ลุ่มวัด)","41309",โป่งแยง,แม่ริม,เชียงใหม่,./0.png
99.0803789368619,18.8831917894622,"1394","18078","1465",บ้านเมืองวะ,"41313",เมืองเล็น,สันทราย,เชียงใหม่,./0.png
99.3595179960735,18.882861693986,"1395","18079","1467",บ้านแม่ลาย,"41312",ห้วยแก้ว,สันกำแพง,เชียงใหม่,./0.png
98.9958769243032,18.8823053298113,"1396","18080","1470",บ้านวังป้อง,"41309",เหมืองแก้ว,แม่ริม,เชียงใหม่,./0.png
99.0775301399205,18.8822892174179,"1397","18081","1473",บ้านป่าไผ่,"41313",เมืองเล็น,สันทราย,เชียงใหม่,./0.png
99.1430424859654,18.8822503733089,"1398","18082","1474",บ้านโพธิ์ทองเจริญ,"41304",เชิงดอย,ดอยสะเก็ด,เชียงใหม่,./0.png
99.1069626689605,18.8813708397846,"1399","18083","1476",บ้านร้องเม็ง,"41313",หนองแหย่ง,สันทราย,เชียงใหม่,./0.png
99.1240527521022,18.8813602272793,"1400","18084","1477",บ้านลวงเหนือ,"41304",ลวงเหนือ,ดอยสะเก็ด,เชียงใหม่,./0.png
99.1107598722824,18.8804648366556,"1401","18085","1489",บ้านแม่คือ,"41313",หนองแหย่ง,สันทราย,เชียงใหม่,./0.png
99.1117093164143,18.8804642689092,"1402","18086","1490",บ้านหนองแหย่ง,"41313",หนองแหย่ง,สันทราย,เชียงใหม่,./0.png
99.1401926232326,18.8804449831354,"1403","18087","1491",บ้านปทุมนิเวศน์,"41304",เชิงดอย,ดอยสะเก็ด,เชียงใหม่,./0.png
99.124051421784,18.8795526670752,"1404","18088","1497",บ้านลวงเหนือ,"41304",ลวงเหนือ,ดอยสะเก็ด,เชียงใหม่,./0.png
98.9930287049352,18.8786901159747,"1405","18089","1498",บ้านทุ่งป่าเก็ด,"41309",เหมืองแก้ว,แม่ริม,เชียงใหม่,./0.png
98.612310256313,18.877382510584,"1406","18090","1503",บ้านหาดส้มป่อย,"41311",แม่สาบ,สะเมิง,เชียงใหม่,./0.png
99.0367025584869,18.8777828438003,"1407","18091","1504",บ้านแม่แก๊ดน้อย,"41313",ป่าไผ่,สันทราย,เชียงใหม่,./0.png
99.0680337614847,18.8777740244687,"1408","18092","1506",บ้านเมืองขอน,"41313",เมืองเล็น,สันทราย,เชียงใหม่,./0.png
99.0784770705959,18.8768661304497,"1409","18093","1508",บ้านหัวโก,"41313",เมืองเล็น,สันทราย,เชียงใหม่,./0.png
99.0984149850138,18.876856652109,"1410","18094","1509",บ้านบวกเปา,"41313",หนองแหย่ง,สันทราย,เชียงใหม่,./0.png
98.982585283333,18.8750743012905,"1411","18095","1512",บ้านหนองเขียว,"41309",เหมืองแก้ว,แม่ริม,เชียงใหม่,./0.png
99.0680326673671,18.8750626785148,"1412","18096","1513",บ้านป่าเหมือด,"41313",เมืองเล็น,สันทราย,เชียงใหม่,./0.png
98.9683443904906,18.8732648579337,"1413","18097","1523",บ้านดอนแก้ว,"41309",ดอนแก้ว,แม่ริม,เชียงใหม่,./0.png
99.0234099012429,18.8732660780555,"1414","18098","1524",บ้านสหกรณ์นิคม,"41313",หนองจ๊อม,สันทราย,เชียงใหม่,./0.png
99.1117045256774,18.8732340220596,"1415","18099","1525",บ้านสันอุ้ม,"41304",เชิงดอย,ดอยสะเก็ด,เชียงใหม่,./0.png
98.8259348086214,18.8722823568811,"1416","18100","1527","บ้านม่วงคำ (ทุ่งบน,หลวง)","41309",โป่งแยง,แม่ริม,เชียงใหม่,./0.png
99.0395493663657,18.8714557819926,"1417","18101","1529",บ้านแม่แก็ดหลวง,"41313",สันทรายหลวง,สันทราย,เชียงใหม่,./0.png
99.1050575749687,18.8714303299355,"1418","18102","1530",บ้านแม่ปูคาใต้,"41304",เชิงดอย,ดอยสะเก็ด,เชียงใหม่,./0.png
99.1458814599763,18.8714028053359,"1419","18103","1531",บ้านเชิงดอย,"41304",เชิงดอย,ดอยสะเก็ด,เชียงใหม่,./0.png
99.0433467138613,18.8705511532775,"1420","18104","1534",บ้านทุ่งยาว,"41313",สันทรายหลวง,สันทราย,เชียงใหม่,./0.png
99.0480934051419,18.869646204159,"1421","18105","1537",บ้านต้นซาง,"41313",สันทรายหลวง,สันทราย,เชียงใหม่,./0.png
99.109803364967,18.8696200264717,"1422","18106","1538",บ้านสันต้นเปา,"41304",เชิงดอย,ดอยสะเก็ด,เชียงใหม่,./0.png
99.0556881836631,18.8687403036007,"1423","18107","1542",บ้านหัวฝาย,"41313",สันทรายหลวง,สันทราย,เชียงใหม่,./0.png
99.0556881836631,18.8687403036007,"1424","18108","1543",บ้านป่าลาน,"41313",สันทรายหลวง,สันทราย,เชียงใหม่,./0.png
99.0727770109797,18.8687344059017,"1425","18109","1544",บ้านเมืองเล็น,"41313",เมืองเล็น,สันทราย,เชียงใหม่,./0.png
98.6389149778242,18.8674945938865,"1426","18110","1547",บ้านแม่ขาน,"41311",แม่สาบ,สะเมิง,เชียงใหม่,./0.png
98.2193196266023,18.8653038923149,"1427","18111","1553",บ้านห้วยผา,"41307",แม่ศึก,แม่แจ่ม,เชียงใหม่,./0.png
98.726257435968,18.8667397715712,"1428","18112","1554",บ้านน้ำริน,"41311",สะเมิงใต้,สะเมิง,เชียงใหม่,./0.png
99.0205609139895,18.8669399323076,"1429","18113","1555",บ้านท่าเกวียน,"41313",หนองจ๊อม,สันทราย,เชียงใหม่,./0.png
99.3518885146216,18.8666084389242,"1430","18114","1558",บ้านแม่กำปอง,"41312",ห้วยแก้ว,สันกำแพง,เชียงใหม่,./0.png
98.9683460866668,18.8642270255974,"1431","18115","1567",บ้านศาลา (สันเหมือง),"41309",ดอนแก้ว,แม่ริม,เชียงใหม่,./0.png
99.0566360459124,18.8642211013701,"1432","18116","1571",บ้านข้าวแท่นหลวง,"41313",สันทรายหลวง,สันทราย,เชียงใหม่,./0.png
99.1012556605304,18.864202178726,"1433","18117","1572",บ้านร้องขี้เหล็ก,"41304",เชิงดอย,ดอยสะเก็ด,เชียงใหม่,./0.png
99.1259388242297,18.8641871162774,"1434","18118","1573",บ้านลวงใต้,"41304",เชิงดอย,ดอยสะเก็ด,เชียงใหม่,./0.png
99.1392297481059,18.8641776501081,"1435","18119","1574",บ้านป่าคา,"41304",เชิงดอย,ดอยสะเก็ด,เชียงใหม่,./0.png
98.9683464257863,18.8624194580745,"1436","18120","1584",บ้านสันเหมือง,"41309",ดอนแก้ว,แม่ริม,เชียงใหม่,./0.png
99.1534683702665,18.8623588934688,"1437","18121","1586",บ้านกิ่วแล,"41304",เชิงดอย,ดอยสะเก็ด,เชียงใหม่,./0.png
99.0870139656671,18.861498031141,"1438","18122","1587",บ้านป่าก้าง,"41313",สันป่าเปา,สันทราย,เชียงใหม่,./0.png
98.5610871601724,18.8600972322891,"1439","18123","1590",บ้านแม่ยางห้า,"41311",บ่อแก้ว,สะเมิง,เชียงใหม่,./0.png
99.0756215021082,18.8605992236032,"1440","18124","1592",บ้านหนองอึ่ง,"41313",สันนาเม็ง,สันทราย,เชียงใหม่,./0.png
98.8069613900023,18.8596107279547,"1441","18125","1594",บ้านกองแหะ (หัวทุ่ง),"41309",โป่งแยง,แม่ริม,เชียงใหม่,./0.png
98.9873335148249,18.8597103658543,"1442","18126","1595",บ้านป่าข่อยใต้,"41301",สันผีเสื้อ,เมือง,เชียงใหม่,./0.png
99.0272053359883,18.8597088091947,"1443","18127","1596",บ้านสันป่าสัก,"41313",หนองจ๊อม,สันทราย,เชียงใหม่,./0.png
99.0281546649703,18.8597086680648,"1444","18128","1597",บ้านโป่ง,"41313",หนองจ๊อม,สันทราย,เชียงใหม่,./0.png
98.7329158183425,18.8586154596584,"1445","18129","1599",บ้านห้วยคอก,"41311",สะเมิงใต้,สะเมิง,เชียงใหม่,./0.png
98.7841788084071,18.858681934541,"1446","18130","1600",บ้านหนองหอย,"41311",สะเมิงใต้,สะเมิง,เชียงใหม่,./0.png
99.1145423032452,18.8578679987126,"1447","18131","1608",บ้านป่าไผ่ศรีโขง,"41304",เชิงดอย,ดอยสะเก็ด,เชียงใหม่,./0.png
99.2730775027566,18.8577029907528,"1448","18132","1609",บ้านห้วยแก้ว,"41312",ห้วยแก้ว,สันกำแพง,เชียงใหม่,./0.png
98.7063382443297,18.8567678900575,"1449","18133","1611",บ้านแม่สาบ,"41311",สะเมิงใต้,สะเมิง,เชียงใหม่,./0.png
99.2673802276791,18.8568074821319,"1450","18134","1613",บ้านปางก๋อง,"41312",ห้วยแก้ว,สันกำแพง,เชียงใหม่,./0.png
98.5487583110951,18.8555489494606,"1451","18135","1614",บ้านป่าเกี๊ยะใน,"41311",บ่อแก้ว,สะเมิง,เชียงใหม่,./0.png
99.0879604773296,18.8560748854019,"1452","18136","1616",บ้านพยากดอนแก้ว,"41313",สันป่าเปา,สันทราย,เชียงใหม่,./0.png
98.7927270995628,18.8550765272631,"1453","18137","1622",บ้านบวกจั่น,"41309",โป่งแยง,แม่ริม,เชียงใหม่,./0.png
98.8335469162596,18.8551174858974,"1454","18138","1623",บ้านผานกกก,"41309",โป่งแยง,แม่ริม,เชียงใหม่,./0.png
99.0433427668195,18.8551868306445,"1455","18139","1624",บ้านปินดก,"41313",สันทรายหลวง,สันทราย,เชียงใหม่,./0.png
98.5554080078423,18.8537574176711,"1456","18140","1626",บ้านป่าเกี๊ยะนอก,"41311",บ่อแก้ว,สะเมิง,เชียงใหม่,./0.png
99.1449173185308,18.8542317073521,"1457","18141","1632",บ้านป่าตึงน้อย,"41304",ป่าป้อง,ดอยสะเก็ด,เชียงใหม่,./0.png
