X,Y,gid,vill_,vill_id,name,amp_id,tam_name,amp_name,prv_name,icon_url
98.9579500415016,18.6753322755215,"108","18585","2795",บ้านกาด,"41316",ขุนคง,หางดง,เชียงใหม่,./0.png
99.1409119164051,19.7227287687965,"882","17566","322",บ้านเด่น,"41305",หนองบัว,ฝาง,เชียงใหม่,./0.png
99.1049651115923,18.7223051732895,"1","18478","2546",บ้านป่าตาล,"41312",บวกค้าง,สันกำแพง,เชียงใหม่,./0.png
99.0063160489007,18.7512559476982,"1694","18378","2343",บ้านเสาหิน,"41301",หนองหอย,เมือง,เชียงใหม่,./0.png
99.1125535735466,18.7223007681817,"2","18479","2547",บ้านต้นดู่,"41312",บวกค้าง,สันกำแพง,เชียงใหม่,./0.png
99.1523929594662,18.7222725988084,"3","18480","2548",บ้านดงขี้เหล็ก,"41312",แช่ช้าง,สันกำแพง,เชียงใหม่,./0.png
98.9389675767937,18.7214208383,"4","18481","2551",บ้านขุนเส,"41316",หนองควาย,หางดง,เชียงใหม่,./0.png
99.1694651573711,18.7204503455181,"5","18482","2563",บ้านป่าเหียง,"41312",แช่ช้าง,สันกำแพง,เชียงใหม่,./0.png
99.2083554541376,18.7204111354559,"6","18483","2565",บ้านป่าตึง,"41312",ออนใต้,สันกำแพง,เชียงใหม่,./0.png
98.5699888685036,18.7191297681486,"7","18484","2570",บ้านทุ่งหลวง,"41314",แม่วิน,สันป่าตอง,เชียงใหม่,./0.png
99.0518450026127,18.7196160110192,"8","18485","2572",บ้านหนองป่าแสะ,"41315",ชมภู,สารภี,เชียงใหม่,./0.png
99.086941120708,18.719603013594,"9","18486","2573",บ้านย่าปาย,"41312",บวกค้าง,สันกำแพง,เชียงใหม่,./0.png
99.0964265524322,18.7195983723718,"10","18487","2574",บ้านร้อยพร้อม,"41312",บวกค้าง,สันกำแพง,เชียงใหม่,./0.png
98.9057697020261,18.7186956926039,"11","18488","2576",บ้านบ่อ,"41316",น้ำแพร่,หางดง,เชียงใหม่,./0.png
98.9190492375316,18.7187018999594,"12","18489","2577",บ้านต้นเกว๋น,"41316",หนองควาย,หางดง,เชียงใหม่,./0.png
98.9285346230323,18.7187057576082,"13","18490","2578",บ้านน้ำซุ้ม,"41316",หนองควาย,หางดง,เชียงใหม่,./0.png
99.1248821654095,18.7186777719513,"14","18491","2580",บ้านบวกค้าง,"41312",บวกค้าง,สันกำแพง,เชียงใหม่,./0.png
99.3022576037005,18.7184756105253,"15","18492","2581",บ้านใหม่,"41312",ทาเหนือ,สันกำแพง,เชียงใหม่,./0.png
98.9114614012439,18.7177946712451,"16","18493","2583",บ้านไร่,"41316",น้ำแพร่,หางดง,เชียงใหม่,./0.png
98.9522483493283,18.7178095034259,"17","18494","2584",บ้านเบ่อ (หนองแก๋ว),"41316",สันผักหวาน,หางดง,เชียงใหม่,./0.png
99.0575353498904,18.7169029573445,"18","18495","2592",บ้านพญาชมภู,"41315",ชมภู,สารภี,เชียงใหม่,./0.png
99.1087552982683,18.7159764353998,"19","18496","2595",บ้านแม่แต,"41312",บวกค้าง,สันกำแพง,เชียงใหม่,./0.png
99.0376156407493,18.7141966201233,"20","18497","2598",บ้านเชียงยืน,"41315",ยางเนิ้ง,สารภี,เชียงใหม่,./0.png
99.0376156407493,18.7141966201233,"21","18498","2599",บ้านยางเนิ้ง,"41315",ยางเนิ้ง,สารภี,เชียงใหม่,./0.png
98.9275891613078,18.7114750130202,"22","18499","2605",บ้านนาบุก,"41316",หนองควาย,หางดง,เชียงใหม่,./0.png
98.9351771486863,18.7114777906938,"23","18500","2606",บ้านสันป่าสัก,"41316",หนองควาย,หางดง,เชียงใหม่,./0.png
99.0205419496959,18.7105840751177,"24","18501","2608",บ้านเวฬุวัน,"41315",หนองผึ้ง,สารภี,เชียงใหม่,./0.png
98.8915473947879,18.709650030143,"25","18502","2609",บ้านแพะขวาง,"41316",น้ำแพร่,หางดง,เชียงใหม่,./0.png
98.9531991205254,18.7096755597739,"26","18503","2610",บ้านสันผักหวานน้อย,"41316",สันผักหวาน,หางดง,เชียงใหม่,./0.png
99.043305575016,18.7096763999071,"27","18504","2611",บ้านศรีโพธาราม,"41315",ยางเนิ้ง,สารภี,เชียงใหม่,./0.png
99.0641719842517,18.7087666198673,"28","18505","2617",บ้านศรีดอนมูล,"41315",ชมภู,สารภี,เชียงใหม่,./0.png
98.9541480961933,18.7078681969722,"29","18506","2619",บ้านท่าไม้ลุง,"41316",สันผักหวาน,หางดง,เชียงใหม่,./0.png
98.9797570250885,18.7078727111948,"30","18507","2620",บ้านบ่อน้ำเย็น,"41301",ป่าแดด,เมือง,เชียงใหม่,./0.png
98.366112153648,18.7049946648309,"31","18508","2621",บ้านแม่นาจรเหนือ,"41307",แม่นาจร,แม่แจ่ม,เชียงใหม่,./0.png
98.9237975957731,18.7060507204709,"32","18509","2622",บ้านโขงขาว,"41316",บ้านแหวน,หางดง,เชียงใหม่,./0.png
98.9162102970935,18.7051436848274,"33","18510","2626",บ้านศาลา,"41316",น้ำแพร่,หางดง,เชียงใหม่,./0.png
98.9996750894573,18.7051624064837,"34","18511","2632",สันป่ากว๋าว,"41315",ท่าวังตาล,สารภี,เชียงใหม่,./0.png
99.0072628008398,18.7051622661118,"35","18512","2633",บ้านบวกครกใต้,"41315",ท่าวังตาล,สารภี,เชียงใหม่,./0.png
98.5539044072341,18.7037279613452,"36","18513","2636",บ้านห้วยตอง,"41314",แม่วิน,สันป่าตอง,เชียงใหม่,./0.png
98.9304376110809,18.7042457041757,"37","18514","2638",บ้านท้าวบุญเรือง,"41316",บ้านแหวน,หางดง,เชียงใหม่,./0.png
98.9712217840435,18.7015450009545,"38","18515","2644",บ้านต้นงิ้ว,"41316",สบแม่ข่า,หางดง,เชียงใหม่,./0.png
99.0679630314419,18.7015348939879,"39","18516","2645",ทุ่งขี้เสือ,"41315",ชมภู,สารภี,เชียงใหม่,./0.png
99.0480454683278,18.7006372551713,"40","18517","2648",บ้านต้นเหียว,"41315",ยางเนิ้ง,สารภี,เชียงใหม่,./0.png
98.9048317761266,18.6997154637241,"41","18518","2649",บ้านดอยถ้ำ,"41316",น้ำแพร่,หางดง,เชียงใหม่,./0.png
98.9162138546165,18.697913295879,"42","18519","2652",บ้านหัวฝาย,"41316",หางดง,หางดง,เชียงใหม่,./0.png
98.9854487485879,18.6979314455929,"43","18520","2654",บ้านท่าขี้ควาย,"41316",สบแม่ข่า,หางดง,เชียงใหม่,./0.png
99.0850331976613,18.6979127348444,"44","18521","2655",บ้านโป่ง,"41312",บวกค้าง,สันกำแพง,เชียงใหม่,./0.png
98.9399247438916,18.6970185895119,"45","18522","2658",บ้านดู่ (ปางกอง),"41316",บ้านแหวน,หางดง,เชียงใหม่,./0.png
98.9114726817273,18.6961035196895,"46","18523","2660",บ้านดงเหนือ,"41316",หางดง,หางดง,เชียงใหม่,./0.png
98.9987266931089,18.6961244056848,"47","18524","2661",บ้านดอนแก้ว,"41315",ดอนแก้ว,สารภี,เชียงใหม่,./0.png
98.9987266931089,18.6961244056848,"48","18525","2662",บ้านตำหนักใต้,"41315",ดอนแก้ว,สารภี,เชียงใหม่,./0.png
98.9987266931089,18.6961244056848,"49","18526","2663",บ้านสันต้นกอก,"41315",ดอนแก้ว,สารภี,เชียงใหม่,./0.png
99.04709578038,18.6961184978133,"50","18527","2664",บ้านป่าแดด,"41315",ยางเนิ้ง,สารภี,เชียงใหม่,./0.png
98.8090453796435,18.6951234175878,"51","18528","2668",บ้านห้วยโท้ง,"41314",สันกลาง,สันป่าตอง,เชียงใหม่,./0.png
98.9494094620526,18.6952137878371,"52","18529","2669",บ้านต้นเฮือด,"41316",บ้านแหวน,หางดง,เชียงใหม่,./0.png
99.0224369132132,18.6952192680483,"53","18530","2671",บ้านหลวง (หนองแฝก),"41315",หนองแฝก,สารภี,เชียงใหม่,./0.png
99.0224369132132,18.6952192680483,"54","18531","2672",บ้านป่าคา (หนองแฝก),"41315",หนองแฝก,สารภี,เชียงใหม่,./0.png
99.0224369132132,18.6952192680483,"55","18532","2673",บ้านหนองแฝก,"41315",หนองแฝก,สารภี,เชียงใหม่,./0.png
99.0698573226272,18.6952076024096,"56","18533","2674",บ้านบุบผาราม,"41315",ชมภู,สารภี,เชียงใหม่,./0.png
99.1191738593913,18.6942789554892,"57","18534","2677",บ้านหนองเหนี่ยง,"41312",บวกค้าง,สันกำแพง,เชียงใหม่,./0.png
99.0423530399389,18.6934082284867,"58","18535","2684",บ้านปากกอง,"41315",ยางเนิ้ง,สารภี,เชียงใหม่,./0.png
98.4069409327713,18.6915718375456,"59","18536","2687",บ้านรวมน้ำใจข่วงเปา,"41307",แม่นาจร,แม่แจ่ม,เชียงใหม่,./0.png
98.80146131948,18.6924041560048,"60","18537","2688",บ้านป่าสันปูเลย,"41314",บ้านกาด,สันป่าตอง,เชียงใหม่,./0.png
98.930442409525,18.6924963142431,"61","18538","2690",บ้านท้าวคำวัง,"41316",บ้านแหวน,หางดง,เชียงใหม่,./0.png
98.9541522326608,18.6925036066796,"62","18539","2692",บ้านป่าหมาก,"41316",บ้านแหวน,หางดง,เชียงใหม่,./0.png
99.047094780993,18.6925032978911,"63","18540","2695",บ้านป่าแดด,"41315",สารภี,สารภี,เชียงใหม่,./0.png
98.9076814813731,18.691582695146,"64","18541","2696",บ้านกอง,"41316",หางดง,หางดง,เชียงใหม่,./0.png
98.9588944165185,18.6916009053243,"65","18542","2698",บ้านเดื่อ,"41316",บ้านแหวน,หางดง,เชียงใหม่,./0.png
98.9740687660977,18.6906998157779,"66","18543","2701",บ้านจอมทอง,"41316",บ้านแหวน,หางดง,เชียงใหม่,./0.png
98.4069503690836,18.6888605815406,"67","18544","2703",บ้านพัฒนาสันติ,"41307",แม่นาจร,แม่แจ่ม,เชียงใหม่,./0.png
98.9380305378052,18.6897875736476,"68","18545","2705",บ้านช่างคำหลวง,"41316",บ้านแหวน,หางดง,เชียงใหม่,./0.png
98.9380305378052,18.6897875736476,"69","18546","2706",บ้านช่างคำน้อย,"41316",บ้านแหวน,หางดง,เชียงใหม่,./0.png
99.0262297122308,18.6897959737406,"70","18547","2707",บ้านสันป่าสัก,"41315",หนองแฝก,สารภี,เชียงใหม่,./0.png
98.9162182992304,18.6888753018346,"71","18548","2710",บ้านร้อง (สันฟ้างาม),"41316",หางดง,หางดง,เชียงใหม่,./0.png
98.9987267471427,18.6888940019942,"72","18549","2711",บ้านดอนแก้ว,"41315",ดอนแก้ว,สารภี,เชียงใหม่,./0.png
98.9200126366992,18.6870693572685,"73","18550","2717",บ้านทรายมูลเหนือ (กำแพงงาม),"41316",หางดง,หางดง,เชียงใหม่,./0.png
98.9389798864137,18.6870764834541,"74","18551","2719",บ้านร้อยจันทร์,"41316",หนองแก๋ว,หางดง,เชียงใหม่,./0.png
99.0300227475539,18.6870840028989,"75","18552","2723",ช้างช่างเคิ่ง,"41315",สารภี,สารภี,เชียงใหม่,./0.png
99.0964081286475,18.6870616397181,"76","18553","2724",บ้านร้องก่องข้าว,"41312",บวกค้าง,สันกำแพง,เชียงใหม่,./0.png
98.8991492081101,18.6861555045799,"77","18554","2725",บ้านน้ำแพร่,"41316",หางดง,หางดง,เชียงใหม่,./0.png
98.9342384219213,18.6861710812054,"78","18555","2726",บ้านหนองแก๋ว,"41316",หนองแก๋ว,หางดง,เชียงใหม่,./0.png
99.0148488575805,18.6861820160477,"79","18556","2727",บ้านกู่แดง,"41315",หนองแฝก,สารภี,เชียงใหม่,./0.png
99.0148488575805,18.6861820160477,"80","18557","2728",บ้านกู่แดง,"41315",หนองแฝก,สารภี,เชียงใหม่,./0.png
99.0461446747075,18.6861769302548,"81","18558","2729",บ้านสารภี,"41315",สารภี,สารภี,เชียงใหม่,./0.png
99.0461446747075,18.6861769302548,"82","18559","2730",บ้านสารภี,"41315",สารภี,สารภี,เชียงใหม่,./0.png
99.062266757015,18.6861722734712,"83","18560","2731",บ้านแม่สะลาบ,"41315",ชมภู,สารภี,เชียงใหม่,./0.png
98.3785172667472,18.6842497666394,"84","18561","2732",บ้านแม่นาจร,"41307",แม่นาจร,แม่แจ่ม,เชียงใหม่,./0.png
98.9522574720858,18.6852727295868,"85","18562","2735",บ้านถวาย,"41316",ขุนคง,หางดง,เชียงใหม่,./0.png
98.6554270338815,18.684058687394,"86","18563","2741",บ้านห้วยหยวก,"41314",แม่วิน,สันป่าตอง,เชียงใหม่,./0.png
98.5444757255603,18.6829184096509,"87","18564","2745",บ้านหนองเต่า,"41314",แม่วิน,สันป่าตอง,เชียงใหม่,./0.png
98.9019958370699,18.6834456123387,"88","18565","2746",บ้านป่าจี้,"41316",หางดง,หางดง,เชียงใหม่,./0.png
98.9067375456102,18.6834480284261,"89","18566","2747",บ้านโรงวัว-ป่าแป๋,"41316",หางดง,หางดง,เชียงใหม่,./0.png
98.9826049540283,18.6834703937616,"90","18567","2750",บ้านน้ำโห้ง,"41316",สบแม่ข่า,หางดง,เชียงใหม่,./0.png
99.0290737677608,18.6834689480571,"91","18568","2752",บ้านสันป่าเดื่อ,"41315",สารภี,สารภี,เชียงใหม่,./0.png
99.0451955978651,18.6834657582868,"92","18569","2753",บ้านปากกอง,"41315",สารภี,สารภี,เชียงใหม่,./0.png
98.9209630943631,18.6825507574074,"93","18570","2757",บ้านแม่ขัก,"41316",หางดง,หางดง,เชียงใหม่,./0.png
98.9351881540667,18.6825562084706,"94","18571","2758",บ้านสันทราย,"41316",หนองแก๋ว,หางดง,เชียงใหม่,./0.png
99.029073613621,18.682565146796,"95","18572","2759",บ้านหนองสี่แจ่ง,"41315",สารภี,สารภี,เชียงใหม่,./0.png
98.3396514838996,18.6805020231286,"96","18573","2761",บ้านนาฮ่อง,"41307",แม่ศึก,แม่แจ่ม,เชียงใหม่,./0.png
98.9437234904212,18.6816551605948,"97","18574","2762",บ้านหนองโขง,"41316",หนองแก๋ว,หางดง,เชียงใหม่,./0.png
99.0091584653881,18.6816633736142,"98","18575","2766",บ้านหัวหลิม,"41315",หนองแฝก,สารภี,เชียงใหม่,./0.png
98.920963932351,18.6807431561158,"99","18576","2773",บ้านทรายมูลใต้,"41316",หางดง,หางดง,เชียงใหม่,./0.png
98.9996751359901,18.6807597952034,"100","18577","2776",บ้านน้ำโจ้,"41315",ขัวมุง,สารภี,เชียงใหม่,./0.png
98.8185467306556,18.6788644963602,"101","18578","2781",บ้านหัวฝาย,"41314",สันกลาง,สันป่าตอง,เชียงใหม่,./0.png
98.9579491500498,18.6789474823244,"102","18579","2782",บ้านต้นแก้ว,"41316",ขุนคง,หางดง,เชียงใหม่,./0.png
98.9740705534542,18.6789504013415,"103","18580","2783",บ้านเกาะ,"41316",สบแม่ข่า,หางดง,เชียงใหม่,./0.png
98.6554398197465,18.6777321913461,"104","18581","2785",บ้านแม่สะป๊อก,"41314",แม่วิน,สันป่าตอง,เชียงใหม่,./0.png
98.8337215043903,18.6770709532103,"105","18582","2788",บ้านละโว้,"41314",สันกลาง,สันป่าตอง,เชียงใหม่,./0.png
99.0556253041876,18.6771363478962,"106","18583","2790",บ้านสันกับตองเหนือ,"41315",สารภี,สารภี,เชียงใหม่,./0.png
98.8261369203746,18.6752564850429,"107","18584","2793",บ้านหนองไหว,"41314",สันกลาง,สันป่าตอง,เชียงใหม่,./0.png
98.9076907803322,18.6744104913359,"109","18586","2796",บ้านห้วยแก้ว,"41316",น้ำแพร่,หางดง,เชียงใหม่,./0.png
98.95510538652,18.6744278149363,"110","18587","2797",บ้านขุนคงหลวง,"41316",ขุนคง,หางดง,เชียงใหม่,./0.png
98.938036779155,18.6726153542318,"111","18588","2806",บ้านสารภี,"41316",หนองแก๋ว,หางดง,เชียงใหม่,./0.png
98.9285543362618,18.6717081839274,"112","18589","2809",บ้านยังปวน,"41316",หนองแก๋ว,หางดง,เชียงใหม่,./0.png
98.9209689582634,18.6698975410381,"113","18590","2817",บ้านสันปูเลย,"41316",หนองแก๋ว,หางดง,เชียงใหม่,./0.png
98.9826063368179,18.6699133645598,"114","18591","2818",บ้านแสนตอ,"41315",ขัวมุง,สารภี,เชียงใหม่,./0.png
99.2955332533115,18.66968163918,"115","18592","2819",บ้านห้วยบง,"41312",ทาเหนือ,สันกำแพง,เชียงใหม่,./0.png
98.8375224673929,18.6689400862676,"116","18593","2820",บ้านหนองห้า,"41314",สันกลาง,สันป่าตอง,เชียงใหม่,./0.png
98.9389866776203,18.6680966543278,"117","18594","2825",บ้านบวก,"41316",หนองแก๋ว,หางดง,เชียงใหม่,./0.png
98.9683826565093,18.6681039033193,"118","18595","2827",บ้านท่าศาลา,"41316",สบแม่ข่า,หางดง,เชียงใหม่,./0.png
98.887782015269,18.6662654372737,"119","18596","2829",บ้านจำปาลาว,"41314",สันกลาง,สันป่าตอง,เชียงใหม่,./0.png
98.820457626048,18.6653093504803,"120","18597","2833",บ้านทุ่งศาลา,"41314",บ้านกาด,สันป่าตอง,เชียงใหม่,./0.png
98.8299400038546,18.6653181745931,"121","18598","2834",บ้านเหมืองฟู,"41314",บ้านแม,สันป่าตอง,เชียงใหม่,./0.png
98.9209710513741,18.6653785310489,"122","18599","2835",บ้านเหมืองง่า,"41316",หนองแก๋ว,หางดง,เชียงใหม่,./0.png
98.9996751686923,18.663587549135,"123","18600","2838",บ้านแควตุ่น,"41315",ท่ากว้าง,สารภี,เชียงใหม่,./0.png
98.3435175807453,18.6615367285303,"124","18601","2839",บ้านนาฮ่องใต้,"41307",แม่ศึก,แม่แจ่ม,เชียงใหม่,./0.png
99.2993135850335,18.6624453071441,"125","18602","2841",บ้านป่างิ้ว,"41312",ทาเหนือ,สันกำแพง,เชียงใหม่,./0.png
98.9645909390303,18.6617766058509,"126","18603","2842",บ้านหนองคำ,"41316",สบแม่ข่า,หางดง,เชียงใหม่,./0.png
98.87356235165,18.660833594747,"127","18604","2843",บ้านห้วยส้ม,"41314",สันกลาง,สันป่าตอง,เชียงใหม่,./0.png
98.6630636581813,18.6587664330294,"128","18605","2848",บ้านห้วยโป่ง,"41314",แม่วิน,สันป่าตอง,เชียงใหม่,./0.png
98.838480135518,18.6589991085736,"129","18606","2849",บ้านจอมแจ้ง,"41314",สันกลาง,สันป่าตอง,เชียงใหม่,./0.png
98.9048549772523,18.6581406398387,"130","18607","2853",บ้านทุ่งอ้อหลวง,"41316",หารแก้ว,หางดง,เชียงใหม่,./0.png
98.6886697516889,18.6560992258448,"131","18608","2857",บ้านสบวิน,"41314",แม่วิน,สันป่าตอง,เชียงใหม่,./0.png
98.9058041756399,18.656333512295,"132","18609","2859",บ้านป่าแงะ,"41316",หารแก้ว,หางดง,เชียงใหม่,./0.png
98.9589031280037,18.6554488229133,"133","18610","2864",บ้านท่าขุนคง,"41316",ขุนคง,หางดง,เชียงใหม่,./0.png
98.8517589108266,18.6544910467007,"134","18611","2866",บ้านสันเหนือ,"41314",สันกลาง,สันป่าตอง,เชียงใหม่,./0.png
98.9238206167779,18.654534072751,"135","18612","2867",บ้านสันป่าสัก,"41316",หารแก้ว,หางดง,เชียงใหม่,./0.png
99.0006233683142,18.654549511494,"136","18613","2868",บ้านร้องเดื่อ,"41315",ท่ากว้าง,สารภี,เชียงใหม่,./0.png
99.0006233683142,18.654549511494,"137","18614","2869",บ้านแคว,"41315",ท่ากว้าง,สารภี,เชียงใหม่,./0.png
99.3002459027536,18.6534058808133,"138","18615","2871",บ้านห้วยยาบ,"41312",ทาเหนือ,สันกำแพง,เชียงใหม่,./0.png
98.9276148753434,18.6509203575694,"139","18616","2880",บ้านขันแก้ว,"41316",หารแก้ว,หางดง,เชียงใหม่,./0.png
98.9446817858722,18.6509261551991,"140","18617","2881",บ้านร้องแหย่ง,"41316",หนองแก๋ว,หางดง,เชียงใหม่,./0.png
99.0025196664869,18.65003047393,"141","18618","2884",บ้านในแคว,"41315",ท่ากว้าง,สารภี,เชียงใหม่,./0.png
98.8394376873203,18.6490581146128,"142","18619","2885",บ้านแพะสันใหม่,"41314",สันกลาง,สันป่าตอง,เชียงใหม่,./0.png
98.9987270506218,18.6482228772084,"143","18620","2892",บ้านหนองโป่ง,"41315",ท่ากว้าง,สารภี,เชียงใหม่,./0.png
98.8280617320626,18.6472404507528,"144","18621","2893",บ้านเด่น,"41314",บ้านแม,สันป่าตอง,เชียงใหม่,./0.png
98.8849500689149,18.6472838725539,"145","18622","2894",บ้านแม่กุ้งบก,"41314",สันกลาง,สันป่าตอง,เชียงใหม่,./0.png
98.9096017242072,18.6472973426077,"146","18623","2895",บ้านป่าบง,"41314",สันกลาง,สันป่าตอง,เชียงใหม่,./0.png
